<?xml version="1.0" encoding="utf-8"?>
<NewsItem xmlns="https://www.alternatives-economiques.fr" xmlns:xsi="http://www.w3.org/2001/XMLSchema-instance" xmlns:xlink="http://www.w3.org/1999/xlink" xsi:schemaLocation="https://www.alternatives-economiques.fr ../../../xsd/short.xsd" standard="AE-XML" id="K4-10021" version="1">
  <rightsInfo>
    <copyrightHolder>
      Alternatives Economiques
    </copyrightHolder>
    <copyrightNotice>
      Copyright 2018 Alternatives Economiques - Toute reproduction, même partielle, des textes, infographies et documents parus est soumis à l'autorisation préalable de l'éditeur.
    </copyrightNotice>
  </rightsInfo>
  <itemMeta>
    <parentPublication xlink:href="K4-10001.xml"/>
    <parentItem xlink:href="K4-XXXXX.xml" />
    <itemClass type="short"/>
    <embargoed>2018-11-29T09:30:10Z</embargoed>
  </itemMeta>
  <contentMeta>
    <created>2018-10-29T09:30:10Z</created>
    <modified>2018-10-29T09:30:10Z</modified>
    <title>Evolution de la dépense par étudiant, des effectifs étudiants, des enseignants titulaires et des enseignants non permanents, base 100 = 2000</title>
    <genre>graphique</genre>
    <source>Ministère de l'Enseignement supérieur et de la Recherche, caluls Alternatives Economiques</source>
    <unit>Base 100 = 200</unit>
    <figure>
      <caption/>
      <copyright/>
      <uri>path/to/file.jpg</uri>
    </figure>
  </contentMeta>
  <contentSet>
    <inlineXML contenttype="text/html"/>
  </contentSet>
</NewsItem>
