<?xml version="1.0" encoding="utf-8"?>
<NewsItem xmlns="https://www.alternatives-economiques.fr" xmlns:xsi="http://www.w3.org/2001/XMLSchema-instance" xmlns:xlink="http://www.w3.org/1999/xlink" xsi:schemaLocation="https://www.alternatives-economiques.fr https://cdn.jsdelivr.net/gh/alter-eco/ae-xml@0.0.3-alpha/xsd/short.xsd" standard="AE-XML" id="K4-10022" version="1">
  <rightsInfo>
    <copyrightHolder>
      Alternatives Economiques
    </copyrightHolder>
    <copyrightNotice>
      Copyright 2018 Alternatives Economiques - Toute reproduction, même partielle, des textes, infographies et documents parus est soumis à l'autorisation préalable de l'éditeur.
    </copyrightNotice>
  </rightsInfo>
  <itemMeta>
    <parentPublication xlink:href="K4-10001.xml"/>
    <parentItem xlink:href="K4-XXXXX.xml"/>
    <itemClass type="short"/>
    <embargoed>2018-11-29T09:30:10Z</embargoed>
  </itemMeta>
  <contentMeta>
    <created>2018-10-29T09:30:10Z</created>
    <modified>2018-10-29T09:30:10Z</modified>
    <title>Le grand cycle des crises</title>
    <genre>graphique</genre>
    <figure>
      <caption/>
      <copyright/>
      <uri><![CDATA[https://images.unsplash.com/photo-1546704259-d4dac118f426?ixlib=rb-1.2.1&q=85&fm=jpg&crop=entropy&cs=srgb]]></uri>
    </figure>
  </contentMeta>
  <contentSet>
    <HTML5/>
  </contentSet>
</NewsItem>
