<?xml version="1.0" encoding="utf-8"?>
<NewsItem 
  xmlns="AlterEco"
  xmlns:xsi="http://www.w3.org/2001/XMLSchema-instance"
  xsi:schemaLocation="https://www.alternatives-economiques.fr/ ../../../xsd/short.xsd"
  standard="AE-XML"

  id="A382-065-A"
  version="1"
  >
  <rightsInfo>
    <copyrightHolder>
      Alternatives Economiques
    </copyrightHolder>
    <copyrightNotice>
      Copyright 2018 Alternatives Economiques - Toute reproduction, même partielle, des textes, infographies et documents parus est soumis à l'autorisation préalable de l'éditeur.
    </copyrightNotice>
  </rightsInfo>
  <itemMeta>
    <parentPublication id="A382" />
    <parentItem id="A382-064-A" />
    <itemClass type="short"/>
    <embargoed>YYYY-MM-DDTHH:MM:SSZ</embargoed>
  </itemMeta>
  <contentMeta>
    <created>YYYY-MM-DDTHH:MM:SS</created>
    <modified>YYYY-MM-DDTHH:MM:SS</modified>
    <title>Le grand cycle des crises</title>
    <genre>graphique</genre>
    <figure>
      <uri>path/to/file.jpg</uri>
    </figure>
  </contentMeta>
  <contentSet>
    <inlineXML contenttype="text/html"></inlineXML>
  </contentSet>
</NewsItem>